{
  "$schema": "https://json-schema.org/draft/2020-12/schema",
  "$id": "https://bench.local/schema/bench-topology/0",
  "title": "Bench topology manifest, v0",
  "description": "One app's map: every step and every possible branch, so untaken branches render; plus, optionally, what the app can read (sources), what it can do (actions, never) and plain-language notes for Presentation mode. Registered by the app; the bench stores nothing app-specific. Edge vocabulary follows Open Agent Spec (ControlFlowEdge: from_node, from_branch, to_node). Keys starting with x- are free for an app's own extensions at the top level and on app, nodes, edges, panels, sources and actions; any other unknown key is rejected. See SPEC.md section 4.",
  "type": "object",
  "required": [
    "v",
    "app",
    "nodes",
    "edges"
  ],
  "properties": {
    "v": {
      "const": "bench-topology/0"
    },
    "app": {
      "type": "object",
      "required": [
        "id",
        "name"
      ],
      "properties": {
        "id": {
          "type": "string",
          "pattern": "^[a-z0-9][a-z0-9_.-]*$"
        },
        "name": {
          "type": "string"
        },
        "url": {
          "type": "string"
        },
        "description": {
          "type": "string"
        },
        "privacy_note": {
          "type": "string",
          "description": "What the app hides on this screen, in plain words. Presentation shows it instead of a generic line; it must not claim more than the app does."
        },
        "track_record": {
          "type": "string",
          "description": "The app's own claim about how it has performed, shown attributed to the app."
        }
      },
      "patternProperties": {
        "^x-": {}
      },
      "additionalProperties": false
    },
    "nodes": {
      "type": "array",
      "minItems": 1,
      "items": {
        "type": "object",
        "required": [
          "id"
        ],
        "properties": {
          "id": {
            "type": "string",
            "minLength": 1,
            "not": {
              "const": "_run"
            }
          },
          "label": {
            "type": "string"
          },
          "plain_label": {
            "type": "string",
            "description": "The Presentation name, in plain words. Falls back to label, then id."
          },
          "kind": {
            "enum": [
              "step",
              "llm",
              "tool",
              "retrieval",
              "gate",
              "check",
              "terminal"
            ],
            "description": "Picks the icon and which details the node box shows. Default step. check: a node that guards the app (its Checks row)."
          },
          "description": {
            "type": "string",
            "description": "What this step does, in plain words (the node's note)."
          },
          "actor": {
            "enum": [
              "ai",
              "rule",
              "person",
              "app"
            ],
            "description": "Who does this step. Default from kind: llm->ai, gate->person, check->rule, anything else->app."
          },
          "moment": {
            "type": "boolean",
            "description": "Replay's Play pauses here (a moment worth stopping on)."
          }
        },
        "patternProperties": {
          "^x-": {}
        },
        "additionalProperties": false
      }
    },
    "edges": {
      "type": "array",
      "items": {
        "type": "object",
        "required": [
          "from",
          "to"
        ],
        "properties": {
          "from": {
            "type": "string"
          },
          "to": {
            "type": "string"
          },
          "from_branch": {
            "type": "string",
            "description": "The branch of `from` that selects this edge (Agent Spec from_branch). Matched against a decision event's data.branch; also drawn as the edge label."
          },
          "description": {
            "type": "string",
            "description": "What taking this branch means, in plain words; on an untaken edge, why it wasn't taken."
          },
          "plain_label": {
            "type": "string",
            "description": "Optional. The branch in Presentation's words; drawn as the edge label and the source box's \"→\" line there. Falls back to the target node's plain_label."
          }
        },
        "patternProperties": {
          "^x-": {}
        },
        "additionalProperties": false
      }
    },
    "panels": {
      "type": "array",
      "items": {
        "type": "object",
        "required": [
          "id",
          "title",
          "event_types"
        ],
        "properties": {
          "id": {
            "type": "string"
          },
          "title": {
            "type": "string"
          },
          "event_types": {
            "type": "array",
            "items": {
              "type": "string"
            },
            "minItems": 1
          },
          "nodes": {
            "type": "array",
            "items": {
              "type": "string"
            }
          },
          "mode": {
            "enum": [
              "latest",
              "append"
            ],
            "description": "latest: show the most recent matching event; append: list every matching event. Default latest."
          },
          "fields": {
            "type": "array",
            "description": "Declared panel: show only these data keys, in order, from the matching events. The raw view stays one click away.",
            "items": {
              "oneOf": [
                {
                  "type": "string"
                },
                {
                  "type": "object",
                  "required": [
                    "key"
                  ],
                  "additionalProperties": false,
                  "properties": {
                    "key": {
                      "type": "string"
                    },
                    "label": {
                      "type": "string"
                    },
                    "format": {
                      "enum": [
                        "text",
                        "number",
                        "number:1",
                        "number:2",
                        "number:4",
                        "usd",
                        "ms",
                        "tokens",
                        "percent",
                        "json",
                        "quote"
                      ]
                    }
                  }
                }
              ]
            }
          },
          "story": {
            "type": "boolean",
            "description": "Rendered by the app's story script (its panels[<id>] function). Falls back to fields, then the generic view, if the story has none."
          },
          "audience": {
            "enum": [
              "both",
              "presentation",
              "engineering"
            ],
            "description": "Which mode shows this panel. Default both. Presentation shows both and presentation panels; Engineering shows all."
          }
        },
        "patternProperties": {
          "^x-": {}
        },
        "additionalProperties": false
      }
    },
    "sources": {
      "type": "array",
      "description": "What the app can read: documents, tables, systems. Item text never lives here; it arrives only in retrieval hits.",
      "items": {
        "type": "object",
        "required": [
          "id",
          "title",
          "kind",
          "description"
        ],
        "properties": {
          "id": {
            "type": "string",
            "minLength": 1,
            "description": "Named by retrieval events' data.source."
          },
          "title": {
            "type": "string"
          },
          "kind": {
            "type": "string",
            "description": "Open set, e.g. documents, database, api, inbox, message."
          },
          "description": {
            "type": "string",
            "description": "The app's own statement of what this is and what it can't see; shown attributed to the app."
          },
          "count": {
            "type": "integer",
            "minimum": 0,
            "description": "How many items the source holds, when items are not listed (or not all are)."
          },
          "items": {
            "type": "array",
            "items": {
              "type": "object",
              "required": [
                "id",
                "title"
              ],
              "properties": {
                "id": {
                  "type": "string",
                  "minLength": 1,
                  "description": "Matches retrieval hits[].id, check_result evidence and decision cited."
                },
                "title": {
                  "type": "string"
                }
              },
              "patternProperties": {
                "^x-": {}
              },
              "additionalProperties": false
            }
          }
        },
        "patternProperties": {
          "^x-": {}
        },
        "additionalProperties": false
      }
    },
    "actions": {
      "type": "array",
      "description": "What the app can do in the world (tool calls, writes).",
      "items": {
        "type": "object",
        "required": [
          "id",
          "title",
          "description"
        ],
        "properties": {
          "id": {
            "type": "string",
            "minLength": 1
          },
          "title": {
            "type": "string"
          },
          "description": {
            "type": "string"
          }
        },
        "patternProperties": {
          "^x-": {}
        },
        "additionalProperties": false
      }
    },
    "never": {
      "type": "array",
      "description": "What the app can never do, in plain words; shown as the app's statement.",
      "items": {
        "type": "string",
        "minLength": 1
      }
    },
    "node_from": {
      "description": "OTLP apps only: how a span maps to a node.",
      "oneOf": [
        {
          "type": "object",
          "required": [
            "attribute"
          ],
          "properties": {
            "attribute": {
              "type": "string"
            }
          },
          "additionalProperties": false
        },
        {
          "type": "object",
          "required": [
            "span_name"
          ],
          "properties": {
            "span_name": {
              "const": true
            }
          },
          "additionalProperties": false
        }
      ]
    },
    "story": {
      "type": "boolean",
      "description": "The app registers a story script with its map (custom panels and renderers). See SPEC.md section 5."
    }
  },
  "patternProperties": {
    "^x-": {}
  },
  "additionalProperties": false
}
