{
  "v": "bench-topology/0",
  "app": {
    "id": "hello-agent",
    "name": "Hello agent (synthetic example)",
    "description": "A made-up support triage agent that ships with the bench as its example.",
    "privacy_note": "Email addresses are hidden on this screen. (A made-up example: the AI saw the original message.)",
    "track_record": "A made-up example: it has never been tested on real requests."
  },
  "nodes": [
    {
      "id": "receive",
      "label": "receive",
      "plain_label": "Message arrives",
      "kind": "step",
      "actor": "app",
      "description": "A support message comes in."
    },
    {
      "id": "triage",
      "label": "triage",
      "plain_label": "Decide who handles it",
      "kind": "llm",
      "description": "The AI reads the message and decides: answer it from the help docs, or hand it to a person.",
      "moment": true
    },
    {
      "id": "lookup",
      "label": "look up docs",
      "plain_label": "Look up the help docs",
      "kind": "retrieval",
      "actor": "rule",
      "description": "A search, not the AI, picks the help-doc pages that best match the message."
    },
    {
      "id": "answer",
      "label": "draft answer",
      "plain_label": "Write the answer",
      "kind": "llm",
      "description": "The AI writes a reply using only the pages it was given."
    },
    {
      "id": "answer_check",
      "label": "answer check",
      "plain_label": "Check the answer",
      "kind": "check",
      "description": "Code, not the AI, checks that the answer only uses steps from the pages it was given. It can't tell whether a correctly quoted step is the wrong advice.",
      "moment": true,
      "x-states": {
        "passed": "\u2713 Passed: {detail}",
        "failed": "\u2715 Didn't pass: {detail}",
        "not_on_path": "\u2013 Not needed: the AI didn't write an answer this time."
      }
    },
    {
      "id": "escalate",
      "label": "escalate",
      "plain_label": "A person takes over",
      "kind": "gate",
      "description": "A person from the security team confirms they're taking it before anything is sent.",
      "moment": true
    },
    {
      "id": "reply",
      "label": "reply",
      "plain_label": "Reply",
      "kind": "terminal",
      "description": "The person who asked gets the reply."
    }
  ],
  "edges": [
    {
      "from": "receive",
      "to": "triage"
    },
    {
      "from": "triage",
      "to": "lookup",
      "from_branch": "answerable",
      "description": "It decided the help docs already answer this."
    },
    {
      "from": "triage",
      "to": "escalate",
      "from_branch": "needs_human",
      "description": "It decided a person must handle this. The AI won't act on it."
    },
    {
      "from": "lookup",
      "to": "answer"
    },
    {
      "from": "answer",
      "to": "answer_check"
    },
    {
      "from": "answer_check",
      "to": "reply",
      "from_branch": "passed",
      "description": "The answer held up, so it's sent."
    },
    {
      "from": "escalate",
      "to": "reply"
    }
  ],
  "sources": [
    {
      "id": "docs",
      "title": "Help docs",
      "kind": "documents",
      "count": 12,
      "description": "The only pages it can look things up in. It can't see your account, your billing or your messages.",
      "items": [
        {
          "id": "doc-1",
          "title": "Signing in"
        },
        {
          "id": "doc-2",
          "title": "Changing your email"
        },
        {
          "id": "doc-3",
          "title": "Resetting your password"
        },
        {
          "id": "doc-4",
          "title": "Billing and invoices"
        },
        {
          "id": "doc-5",
          "title": "Cancelling a plan"
        },
        {
          "id": "doc-6",
          "title": "Exporting your data"
        },
        {
          "id": "doc-7",
          "title": "Notifications"
        },
        {
          "id": "doc-8",
          "title": "Team members"
        },
        {
          "id": "doc-9",
          "title": "Two-factor setup"
        },
        {
          "id": "doc-10",
          "title": "API keys"
        },
        {
          "id": "doc-11",
          "title": "Mobile app"
        },
        {
          "id": "doc-12",
          "title": "Contacting support"
        }
      ]
    },
    {
      "id": "message",
      "title": "The message",
      "kind": "message",
      "description": "Only the message itself, not earlier conversations."
    }
  ],
  "actions": [
    {
      "id": "route_to_security",
      "title": "Hand it to security on-call",
      "description": "Only after a person confirms."
    }
  ],
  "never": [
    "Change a password or email itself",
    "Read anything beyond the message and the help docs"
  ],
  "panels": [
    {
      "id": "triage",
      "title": "Triage (story panel)",
      "plain_title": "Who it went to",
      "event_types": [
        "decision"
      ],
      "nodes": [
        "triage"
      ],
      "story": true
    },
    {
      "id": "docs",
      "title": "Docs found (declared fields)",
      "event_types": [
        "retrieval"
      ],
      "audience": "engineering",
      "fields": [
        {
          "key": "query",
          "label": "query"
        },
        {
          "key": "hits",
          "label": "hits",
          "format": "json"
        }
      ]
    },
    {
      "id": "gate",
      "title": "Escalation",
      "event_types": [
        "gate_waiting",
        "gate_resolved"
      ],
      "mode": "append",
      "audience": "engineering"
    },
    {
      "id": "llm",
      "title": "Model calls",
      "event_types": [
        "llm_call"
      ],
      "mode": "append",
      "audience": "engineering"
    }
  ],
  "story": true
}
